,publishedAt,title
0,4/15/2020,"The unexpected items deemed 'essential',Why has NYC death toll suddenly surged?,Trudeau: 'We cannot be in a rush' to reopen,Sources believe coronavirus originated in Wuhan lab as part of China's efforts to compete with US,Los Angeles County release of 4K inmates is 'uncharted territory,' reporter tells Tucker Carlson,Medopad rebrands as Huma, acquires BioBeats and TLT to expand its biomarker platform,Developer platform Glitch debuts $10/mo tier for power users,Extra Crunch members save money with Partner Perks and event discounts,Coronavirus rattles NASA, but Commercial Crew and Mars Perseverance rover are on track,Britney Spears dances to 'genius' Justin Timberlake's 'Filthy' on IG - Page Six,15 times Trump praised China as coronavirus was spreading across the globe - POLITICO,Trump says coronavirus pandemic has peaked, some states to reopen before May 1 - New York Post ,Google Does the Bare Minimum to Keep Industry It Destroyed on Life Support - Gizmodo,NASA discovery of planet remarkably like ours gives hope for 'second Earth' - CNET,Gov. Newsom announces more benefits for unemployed Californians amid coronavirus pandemic - CNBC"
1,4/16/2020,"Biggest cosmic mystery 'step closer' to solution,Trump says 'we'll see' about Wuhan lab claims,Landslide victory for South Korean ruling party,Coronavirus: Asian growth will grind to a 'standstill' warns IMF,How California kept ahead of the curve,Michigan protesters honk against coronavirus order,Trump says virus has 'passed the peak' in US,Trump backers protest Michigan stay-at-home orders at state capitol,Tip leads police to 17 bodies at a New Jersey nursing home,Trump's big show of opening the economy will hide the real story,Trump threatens to adjourn Congress so he can make recess appointments,Watch: Massive Explosion At Paper Mill In Maine | NBC News NOW,In CA: Undocumented immigrants join 2.7 Californians in getting unemployment aid,Massachusetts man charged with trying to blow up Jewish nursing home,Trump denied he wanted his name on stimulus checks. Here’s how it happened.,Bangladesh coast guard rescues 396 Rohingya in drifting boat; 24 dead,As Japan slows down, prices at risk of falling while bars, restaurants suffer,U.S. weekly jobless claims seen underscoring deepening economic slump,Trump backers protest Michigan stay-at-home orders at state capitol,Face masks may be 'new normal' in post-virus life as U.S. prepares gradual reopening,United cuts May flights by 90%, tells employees to brace for job cuts,Warren says she would accept an offer to be Biden's running mate,WHO regrets Trump funding halt as global coronavirus cases top 2 million,Stocks slide as dire economic outlook weighs,Explainer: What the U.S. funds freeze could mean for WHO and its work,Sprout.ai raises $2.5M to speed up insurance claims,Gousto, a UK meal-kit service, raises another $41M as business booms under lockdown,Taxfix raises $65 million for its mobile tax filing app,View, the dynamic glass company that raised $1.1 billion from SoftBank in 2018, is laying people off,Financial tech startup Previse raises $11 million to help suppliers get paid faster,Mayfield raises $750 million across two funds,Trump backers protest Michigan stay-at-home orders at state capitol,Última hora del coronavirus en España | Trump sugiere la reapertura económica antes del 1 de mayo cuando EEUU,Donald Trump to announce guidelines on reopening US economy,Trump minaccia di sospendere Congresso - Ultima Ora,Trump, Fda ha autorizzato 48 test - Ultima Ora,Trump, forse superato picco casi - Ultima Ora,Gov. Andrew Cuomo responds to Trump: Testing is a quagmire - CNN Video,Trump to announce guidelines on reopening economy,Trump droht Kongress mit Zwangspause und kündigt Shutdown-Lockerungen an,Joe Biden: test a tappeto e tecnologia per riaprire l’America in sicurezza,Coronavirus, il primo maggio Trump vuole riaprire l’America,EN DIRECT le 16 avril - Coronavirus : le point sur la situation en France et dans le monde,6/14/18: Red and Blue,What US funding cut means for WHO's fight against coronavirus,Trump says new guidelines aim to lift some restrictions,Live updates: Trump to issue guidelines on reopening the economy as Germany moves to lift some coronavirus restrictions,Live updates: Trump to issue guidelines on reopening the economy as Germany moves to lift some coronavirus restrictions,Live updates: Trump to issue guidelines on reopening the economy as Germany moves to lift some coronavirus restrictions,Live updates: Trump to issue guidelines on reopening the economy as Germany moves to lift some coronavirus restrictions,Live updates: Trump to issue guidelines on reopening the economy as Germany moves to lift some coronavirus restrictions,Trump backers protest Michigan stay-at-home orders at state capitol,Última hora del coronavirus en España | Trump sugiere la reapertura económica antes del 1 de mayo cuando EEUU,Donald Trump to announce guidelines on reopening US economy,Trump minaccia di sospendere Congresso - Ultima Ora,Trump, Fda ha autorizzato 48 test - Ultima Ora,Trump, forse superato picco casi - Ultima Ora,Gov. Andrew Cuomo responds to Trump: Testing is a quagmire - CNN Video,Trump to announce guidelines on reopening economy,Trump droht Kongress mit Zwangspause und kündigt Shutdown-Lockerungen an,Joe Biden: test a tappeto e tecnologia per riaprire l’America in sicurezza,Coronavirus, il primo maggio Trump vuole riaprire l’America,EN DIRECT le 16 avril - Coronavirus : le point sur la situation en France et dans le monde,6/14/18: Red and Blue,What US funding cut means for WHO's fight against coronavirus,Trump says new guidelines aim to lift some restrictions,Live updates: Trump to issue guidelines on reopening the economy as Germany moves to lift some coronavirus restrictions,Live updates: Trump to issue guidelines on reopening the economy as Germany moves to lift some coronavirus restrictions,Live updates: Trump to issue guidelines on reopening the economy as Germany moves to lift some coronavirus restrictions,Live updates: Trump to issue guidelines on reopening the economy as Germany moves to lift some coronavirus restrictions,Live updates: Trump to issue guidelines on reopening the economy as Germany moves to lift some coronavirus restrictions,US explores possibility that coronavirus started in Chinese lab, not a market - CNN,Relying on Science and Politics, Merkel Offers a Cautious Virus Re-entry Plan - The New York Times,MLB pitcher Roy Halladay had drugs in system, was doing stunts at time of fatal plane crash: NTSB - Fox News,South Korea's ruling party wins election landslide amid coronavirus outbreak - The Guardian,Trump threatens to adjourn Congress to get his nominees but likely would be impeded by Senate rules - The Washington Post,Watch: Massive Explosion At Paper Mill In Maine | NBC News NOW - NBC News,L.A. coronavirus deaths spike, 42 new fatalities in a day - Los Angeles Times,The Real Housewives of Beverly Hills Season-Premiere Recap: Runway Success - Vulture,Amazon to Shut Down for 5 Days in France After Court Finds Its Coronavirus Response Inadequate - Gizmodo,Some stimulus checks are being sent to the wrong accounts: 'The bank account number is not even close.' - USA TODAY,Massachusetts man charged with trying to blow up Jewish nursing home - NBC News,5 things to know about reopening the U.S. economy from Dr. Anthony Fauci - CBS News,Greatest NFL Draft class ever isn't just about quarterbacks - New York Post ,Hot spots erupt in farm belt states where governors insist lockdowns aren’t needed - POLITICO"
0,2020-04-16,"Trump unveils plan to re-open states in phases,All-round American actor Brian Dennehy dies at 81,Is there any evidence for coronavirus lab release idea?,White House defends Ivanka travel amid lockdown,US megadrought 'already under way',Police find 17 bodies at US nursing home after tip,Lions nap on road during South African lockdown,The story of Captain Tom Moore's walk,Trump Interior official helped clear way for payments to ex-employer,E.P.A. Weakens Controls on Mercury,New Jersey AG opens probe of nursing home deaths after finding 17 bodies in facility hit by coronavirus,Politics and public health collide in Michigan as governor faces angry protests over coronavirus shutdown,Glitches prevent $1,200 stimulus checks from reaching millions of Americans,Pregnant nurse dies of Covid-19 but baby survives after emergency C-section,L.A. County now requires coronavirus masks in public,A body bag request and a tip led cops to find 17 coronavirus deaths at N.J. nursing home,Uber pulls back from operating profit target,Delivery Hero CEO shares what he's learned about managing logistics during a pandemic,Autofleet raises $7.5M to help fleets put idle vehicles into drive,Extra Crunch is now available in Puerto Rico, Guam, and American Samoa,Grain, a startup built expressly atop of Zoom for note-taking and video-clip making, raises $4 million,InHerSight's new app personalizes job matches to women's career goals,COVID-19 could have its own PATRIOT Act, but we need privacy guarantees,Changing policy, Y Combinator cuts its pro rata stake and makes investments case-by-case,Impossible Foods rolls out to nearly 1,000 new grocery stores and supermarkets,US explores possibility that coronavirus spread started in Chinese lab, not a market - CNN,These Nurses Were Suspended For Refusing To Work With Coronavirus Patients Without N95 Masks - BuzzFeed News,Roger Stone denied new trial; gag order lifted - CNN,Broncos release statement regarding Von Miller's COVID-19 diagnosis - DenverBroncos.com,Astronomers watch star dance with a black hole, proving Einstein right (again) - CNET,Meghan Markle's Mom Suggested The Duke And Duchess Of Sussex Volunteer With This Los Angeles Charity - HuffPost,J.J. Abrams is producing a Justice League Dark series for HBO Max - The Verge,Unemployment in Hawaii tops 37% as coronavirus shutdown continues - Hawaii News Now,Smithfield Foods Becomes Largest Coronavirus Hotbed In United States, South Dakota Governor Yet To Mandate Stay Home Order - Forbes,Landon Collins wants Washington to pass on Tua Tagovailoa in NFL Draft - AL.com,Trump’s guidelines for reopening states amid coronavirus pandemic will leave decisions to governors - The Washington Post,Protests erupt after deaths at U.S. factories in Mexican border town - Reuters,Trump snubs Romney by inviting every other GOP senator to council on restarting economy amid coronavirus - Fox News,2020 NFL Mock Draft: Patriots move up for Justin Herbert, Cardinals go rogue with wide receiver - CBS Sports,Microsoft announces the Windows 10 May 2020 Update, the next Windows for your PC - PCWorld,Gilead data suggests coronavirus patients are responding to treatment - STAT,Great, Now We Have to Worry About Sunny Skies Melting Greenland's Ice Sheet - Gizmodo,Global warming is making western U.S. 'megadrought' worse - Los Angeles Times"
1,2020-04-17,"Coronavirus: Singapore sees cases leap among migrant workers,A run through the virus 'warzone' of New York,Roger Stone denied new trial, gag order lifted,Multiple CEOs on Trump's new council say they were not aware of plan to reopen economy,NASA reveals ambitious multi-spacecraft plan to bring a piece of Mars back to Earth,U.S. states extend coronavirus shutdown, Trump unveils plan for return,Charts: How Each State Can Reopen Under President Trump's Guidelines,Top Republicans call on Trump to fund WHO contingent on director-general's resignation | TheHill,Pro-Trump protesters push back on stay-at-home orders,Trump administration rolls back Obama-era EPA rule that curbed toxic pollutants,Trump administration rolls back Obama-era EPA rule that curbed toxic pollutants,Roger Stone denied new trial, gag order lifted,Fed's Kashkari says Trump's 'staged approach' to reopen economy makes sense,Trump anuncia plano em 3 fases para reabertura dos EUA e dá mais poder para governadores,Dow Futures Surge 900 Points as Trump Provides Hope for Economic Reopening,Lo más destacado del jueves en 40 segundos,Federal judge denies Roger Stone a new trial, rejecting claim that jury foreperson was biased,U.S. House Speaker Pelosi says Trump guidelines 'vague and inconsistent',Multiple CEOs on Trump's new council say they were not aware of plan to reopen economy,Trump launches three-phase plan to reopen the US economy,Kamala Harris: President Trump's Failure to Lead On Coronavirus Has Resulted in ‘Body Bags’,White House guidelines for reopening garner mixed reviews | TheHill,Russian Disinformation in Steele Dossier Fueled Collusion Probe,Coronavirus : Donald Trump recommande un redémarrage des Etats-Unis en trois étapes,President Trump unveils phased approach to re-opening America,U.S. states extend coronavirus shutdown, Trump unveils plan for return,Charts: How Each State Can Reopen Under President Trump's Guidelines,Top Republicans call on Trump to fund WHO contingent on director-general's resignation | TheHill,Pro-Trump protesters push back on stay-at-home orders,Trump administration rolls back Obama-era EPA rule that curbed toxic pollutants,Trump administration rolls back Obama-era EPA rule that curbed toxic pollutants,Roger Stone denied new trial, gag order lifted,Fed's Kashkari says Trump's 'staged approach' to reopen economy makes sense,Trump anuncia plano em 3 fases para reabertura dos EUA e dá mais poder para governadores,Dow Futures Surge 900 Points as Trump Provides Hope for Economic Reopening,Lo más destacado del jueves en 40 segundos,Federal judge denies Roger Stone a new trial, rejecting claim that jury foreperson was biased,U.S. House Speaker Pelosi says Trump guidelines 'vague and inconsistent',Multiple CEOs on Trump's new council say they were not aware of plan to reopen economy,Trump launches three-phase plan to reopen the US economy,Kamala Harris: President Trump's Failure to Lead On Coronavirus Has Resulted in ‘Body Bags’,White House guidelines for reopening garner mixed reviews | TheHill,Russian Disinformation in Steele Dossier Fueled Collusion Probe,Coronavirus : Donald Trump recommande un redémarrage des Etats-Unis en trois étapes,President Trump unveils phased approach to re-opening America,Brazilian President Fires Health Minister After Clashes Over Coronavirus Distancing - NPR,‘Ellen’ Crew Furious Over Poor Communication Regarding Pay, Non-Union Workers During Coronavirus Shutdown (EXCLUSIVE) - Variety"
0,2020-04-17,"Poetry from the personal to the universal,New mum meets baby after emergency birth in coma,Could Donald Trump delay the presidential election?,Nasa to launch first manned mission from US in decade,Anti-lockdown protests grow across US,'Voice of WWE' Howard Finkel dies age 69,MSNBC host clashes with Schumer after claiming Dems'standing in the way' of small business aid,Trump says US farmers will receive $19 billion for coronavirus mitigation,'LIBERATE': Trump tweets support for anti-lockdown protests,Trump Is Doing to America What He Did to Ukraine,Why the small business loan program is falling apart at the worst time,Republic acquires Fig, adding games to its startup crowdfunding platform,Top investors predict what's ahead for Boston's VC scene in Q1,The $99 Mendel Air Sensor uses data to help you grow better veggies (or weed),Sales startup People.ai lays off 18% of staff, raises debt round amid COVID-19 uncertainty,GM delivers first ventilators under 30,000-unit government contract,Early Monzo employee Simon Balmain is joining Sphere, the group chat app founded by ex-Yahoo Nick D’Aloisio,Samsung’s new Galaxy Watch app reminds you to wash your damn hands, dummy,Bradley Tusk on starting a company and seed investing in the coronavirus era,Doist founder Amir Salihefendic explains why his remote team doesn't try to do everything in real time,Trump's hype for state lockdown protests puts Twitter and Facebook's new COVID-19 policies to the test,Judge calls alleged investigator misconduct in Lori Loughlin case 'serious and disturbing' - USA TODAY,ACLU warns contact tracing apps monitoring spread of COVID-19 could have 'significant' privacy risks - Daily Mail,'Army' of contact tracers will be needed in coronavirus fight. Experts say that could cost billions. - NBC News,Stanford antibody study estimates COVID-19 infected at least 50 times more people than testing identified in Santa Clara County - KTLA,NikkieTutorials Spills Shocking Details About Meeting Ellen DeGeneres - E! NEWS,Watch live: Coronavirus task force holds briefing as Trump pushes protests, spars with governors - CNBC"
1,2020-04-18,"Double warning over virus antibody tests,Coronavirus: Star-studded concert to be aired,Disability: I lost my legs but am still dancing,'Bath sponge' breakthrough to boost cleaner cars,Bill Maher Blasts Media’s COVID-19 “Panic Porn,” Warning Gloom-And-Doom Coverage May Get Donald Trump Re-Elected,L.A. Mayor Eric Garcetti Gives Coronavirus Update | NBC News,Gov. Ron DeSantis gives some Florida beaches green light to reopen,Texas judge rules all registered voters can vote by mail if they fear catching coronavirus,Behind on testing, Texas tries to be first to reopen,Crenshaw, Maher clash over Trump: Is goal to make president 'look bad' or 'get to the truth'?,Will hydroxychloroquine help fight COVID-19? This trial is trying to find out,Live updates: Global death toll surpasses 150,000; U.S. governors set timelines to end stay-at-home orders,Live updates: Global death toll surpasses 150,000; U.S. governors set timelines to end stay-at-home orders,Live updates: Global death toll surpasses 150,000; U.S. governors set timelines to end stay-at-home orders,Live updates: Global death toll surpasses 150,000; U.S. governors set timelines to end stay-at-home orders,Bill Maher Blasts Media’s COVID-19 “Panic Porn,” Warning Gloom-And-Doom Coverage May Get Donald Trump Re-Elected,Coronavirus News-Ticker: Trump rechnet mit bis zu 65 000 Toten in den USA,Number Of Trump Campaign Donors On Back-To-Work Council Raises Ethics Alarm: Report,Protesters rally across America after Trump urges supporters to 'liberate' states,Trump tweets call to 'liberate' 3 Democratic-led states, sparking pushback from governors | CBC News,Dr. Fauci throws cold water on conspiracy theory that coronavirus escaped a Chinese lab - Business Insider,Dr. Fauci throws cold water on conspiracy theory that coronavirus escaped a Chinese lab - Business Insider,Coronavirus : Les manifestations anti-confinement se multiplient aux Etats-Unis, Trump semble les encourager,Donald Trump Vows to Investigate Wuhan Lab, Coronavirus Bats,U.S. announces $19 billion coronavirus aid for farmers, food buys for poor,Trump: ""The governors are responsible for testing"",Trump says he favors adding money for hospitals in small business coronavirus aid bill,Tension mounts in U.S. over plans to reopen the economy as Trump appears to encourage protests,Trump criticizes Pelosi over stalemate on small business loan funds | TheHill,Crenshaw, Maher clash over Trump: Is goal to make president 'look bad' or 'get to the truth'?,Will hydroxychloroquine help fight COVID-19? This trial is trying to find out,Live updates: Global death toll surpasses 150,000; U.S. governors set timelines to end stay-at-home orders,Live updates: Global death toll surpasses 150,000; U.S. governors set timelines to end stay-at-home orders,Live updates: Global death toll surpasses 150,000; U.S. governors set timelines to end stay-at-home orders,Live updates: Global death toll surpasses 150,000; U.S. governors set timelines to end stay-at-home orders,Bill Maher Blasts Media’s COVID-19 “Panic Porn,” Warning Gloom-And-Doom Coverage May Get Donald Trump Re-Elected,Coronavirus News-Ticker: Trump rechnet mit bis zu 65 000 Toten in den USA,Number Of Trump Campaign Donors On Back-To-Work Council Raises Ethics Alarm: Report,Protesters rally across America after Trump urges supporters to 'liberate' states,Trump tweets call to 'liberate' 3 Democratic-led states, sparking pushback from governors | CBC News,Dr. Fauci throws cold water on conspiracy theory that coronavirus escaped a Chinese lab - Business Insider,Dr. Fauci throws cold water on conspiracy theory that coronavirus escaped a Chinese lab - Business Insider,Coronavirus : Les manifestations anti-confinement se multiplient aux Etats-Unis, Trump semble les encourager,Donald Trump Vows to Investigate Wuhan Lab, Coronavirus Bats,U.S. announces $19 billion coronavirus aid for farmers, food buys for poor,Trump: ""The governors are responsible for testing"",Trump says he favors adding money for hospitals in small business coronavirus aid bill,Tension mounts in U.S. over plans to reopen the economy as Trump appears to encourage protests,Trump criticizes Pelosi over stalemate on small business loan funds | TheHill,2020 WNBA Draft winners and losers: Liberty add Sabrina Ionescu with top pick; Wings land talented trio - CBSSports.com,White House to give $19B in farmer aid - POLITICO,League of Legends: Riot Games is offering up to $100000 to whomever can prove security flaws in Vanguard, VALORANT's anti-cheat system - InvenGlobal,America's First Manned Space Launch in Nearly a Decade Set for May 27 - Gizmodo,Will You Get A Second Stimulus Check? - Forbes,Trump on origins of coronavirus in Chinese lab: 'We're going to find out' - Fox News,Trump Fans Protest Against Governors Who Have Imposed Virus Restrictions - The New York Times,L.A. Mayor Eric Garcetti Gives Coronavirus Update | NBC News - NBC News,Apollo 13: The silence in the blackout from those who were there - BBC News,Dr. Oz, Dr. Drew and Dr. Phil made these claims on Fox News. Now they're backtracking - CNN,Texas judge rules all registered voters can vote by mail if they fear catching coronavirus - CNN,Behind on testing, Texas tries to be first to reopen - CNN,Google is now listing COVID-19 testing centers in search results - The Verge,Adam Silver -- Still too much uncertainty for clear path to NBA's possible return - ESPN"
